S/N,WARD,PROJECT TO BE EXECUTED,LOCATION
1,AKWU-OWERRI AKOKWA WARD,Construction of Culvert,Akwu-Owerri Akokwa
2,AKWU-OWERRI AKOKWA WARD,Construction of Drainage/Gutter,Akwu-Owerri Akokwa
3,NDIMOKO WARD,Construction of a new sanitary facility & Renovation of HM's Staff office in the community primary school,Community Primary School Ndimoko
4,NDIMOKO WARD,Provision of new reading desk furniture/chair for the class rooms,Community Primary School Ndimoko
5,OBODOUKWU WARD,Construction of modern primary school hall (CS3),Obodoukwu
6,OBODOUKWU WARD,Construction of Public toilet at Eke Obodoukwu Market,Obodoukwu
7,OZUAKOLI/UMUAGO WARD,Installation of 33KVA transformer,Ozuakoli/Umuago
8,OZUAKOLI/UMUAGO WARD,Installation of street light,Ozuakoli/Umuago
9,IHEME WARD,Renovation of the Health Centre at Ikpeze Uno,Ikpeze Uno, Iheme Autonomous Community
10,IHEME WARD,Construction of culvert at Umunwoke/Saint Phillips Road,Umunwoke/Saint Phillips Road, Ndi-Akeme Uno, Arondizuogu
11,OSINA WARD,Construction of Culvert,Osina
12,OSINA WARD,Rehabilitation of Road,Osina
13,OZU/EZEMAZU WARD,Training workshop on agriculture and green spaces,Ozu/Ezemazu
14,OZU/EZEMAZU WARD,Develop youth mentorship programmes / after school activities,Ozu/Ezemazu
15,ISIOKPO WARD,Construction of open shades at Affor Isiokpo Market,Isiokpo
16,ISIOKPO WARD,Construction of modern toilet facility in Ideato-North modern primary school,Isiokpo
17,IZUOGU WARD 1,3 toilet blocks facilities for three (3) community schools in ward 1 at Ndiawa,Ndiawa
18,IZUOGU WARD 1,3 toilet blocks facilities for three (3) community schools in ward 1 at Ndiadimoha,Ndiadimoha
19,IZUOGU WARD 2,Road Culverts of b metres length, 1 metre weight and 0.9 Metre depth,Izuogu Ward 2
20,IZUOGU WARD 2,A block of three (3) toilet facilities for schools,Izuogu Ward 2
21,AKPULU WARD,To make or create a centre for craft-training of sewing for students of Akpulu Secondary School Akpulu (ASSA) particularly by installing 4 singer or butterfly sewing machine for the students who will show interest in learning the skill,Akpulu Secondary School Akpulu
22,AKPULU WARD,Construction of culvert at the entrance of umuada or ada Akpulu daughters association,Akpulu
23,UZII UMU-ALAOMA WARD,Two culverts at Umualaoma community to be sited at Uchu/Obinuhu and Etiti-Alaike via Obi Ajaegbu,Umualaoma
24,UZII UMU-ALAOMA WARD,Another Culvert to be sited at uzii community,Uzii
25,UMUKEGWU/UMUOPIA WARD,Roofing of Central school Umuopia Akokwa,Umuopia Akokwa
26,UMUKEGWU/UMUOPIA WARD,Building of toilets in Ekezeala community nursery/primary school,Ekezeala Community Nursery/Primary School Umukegwu
27,UMUOKWARA/UMUEZEAGA WARD,Building of Culverts,Umuokwara/Umuezeaga
28,UMUOKWARA/UMUEZEAGA WARD,Erection of toilet in Umuokwara Central School,Umuokwara Central School
